{
  "schema_version": "1.0.0",
  "contract_version": "3.0.0",
  "expected_count": 112,
  "engines": [
    {
      "engine_id": 1,
      "engine_name": "SYSTEM GOVERNANCE ENGINE",
      "orchestrator": "GovernanceOrchestrator",
      "source": "V2.2.5_RETAINED",
      "primary_output": "governance event / audit record",
      "runtime_status": "NOT_IMPLEMENTED"
    },
    {
      "engine_id": 2,
      "engine_name": "POLICY & LIMITS ENGINE",
      "orchestrator": "GovernanceOrchestrator",
      "source": "V2.2.5_RETAINED",
      "primary_output": "governance event / audit record",
      "runtime_status": "NOT_IMPLEMENTED"
    },
    {
      "engine_id": 3,
      "engine_name": "DATA SOURCE REGISTRY",
      "orchestrator": "DataFoundationOrchestrator",
      "source": "V2.2.5_RETAINED",
      "primary_output": "SourceRegistered/SourceHealth",
      "runtime_status": "NOT_IMPLEMENTED"
    },
    {
      "engine_id": 4,
      "engine_name": "DATA INGESTION ENGINE",
      "orchestrator": "DataFoundationOrchestrator",
      "source": "V2.2.5_RETAINED",
      "primary_output": "RawObservation",
      "runtime_status": "NOT_IMPLEMENTED"
    },
    {
      "engine_id": 5,
      "engine_name": "DATA QUALITY ENGINE",
      "orchestrator": "DataFoundationOrchestrator",
      "source": "V2.2.5_RETAINED",
      "primary_output": "QualityResult",
      "runtime_status": "NOT_IMPLEMENTED"
    },
    {
      "engine_id": 6,
      "engine_name": "TEMPORAL TRUTH ENGINE",
      "orchestrator": "DataFoundationOrchestrator",
      "source": "V2.2.5_RETAINED",
      "primary_output": "TemporalSnapshot",
      "runtime_status": "NOT_IMPLEMENTED"
    },
    {
      "engine_id": 7,
      "engine_name": "DATA LINEAGE ENGINE",
      "orchestrator": "DataFoundationOrchestrator",
      "source": "V2.2.5_RETAINED",
      "primary_output": "LineageRecord",
      "runtime_status": "NOT_IMPLEMENTED"
    },
    {
      "engine_id": 8,
      "engine_name": "CONTRACT / INSTRUMENT MASTER ENGINE",
      "orchestrator": "MarketProfileOrchestrator",
      "source": "V2.2.5_RETAINED",
      "primary_output": "InstrumentMasterRecord",
      "runtime_status": "NOT_IMPLEMENTED"
    },
    {
      "engine_id": 9,
      "engine_name": "HISTORICAL DATA LAKE",
      "orchestrator": "DataFoundationOrchestrator",
      "source": "V2.2.5_RETAINED",
      "primary_output": "DatasetVersion",
      "runtime_status": "NOT_IMPLEMENTED"
    },
    {
      "engine_id": 10,
      "engine_name": "FEATURE FABRIC",
      "orchestrator": "MarketIntelligenceOrchestrator",
      "source": "V2.2.5_RETAINED",
      "primary_output": "Feature/DomainState",
      "runtime_status": "NOT_IMPLEMENTED"
    },
    {
      "engine_id": 11,
      "engine_name": "VOLUME / PROFILE ENGINE",
      "orchestrator": "MarketIntelligenceOrchestrator",
      "source": "V2.2.5_RETAINED",
      "primary_output": "Feature/DomainState",
      "runtime_status": "NOT_IMPLEMENTED"
    },
    {
      "engine_id": 12,
      "engine_name": "ORDER FLOW ENGINE",
      "orchestrator": "MarketIntelligenceOrchestrator",
      "source": "V2.2.5_RETAINED",
      "primary_output": "Feature/DomainState",
      "runtime_status": "NOT_IMPLEMENTED"
    },
    {
      "engine_id": 13,
      "engine_name": "MICROSTRUCTURE ENGINE",
      "orchestrator": "MarketIntelligenceOrchestrator",
      "source": "V2.2.5_RETAINED",
      "primary_output": "Feature/DomainState",
      "runtime_status": "NOT_IMPLEMENTED"
    },
    {
      "engine_id": 14,
      "engine_name": "LIQUIDITY BEHAVIOR ENGINE",
      "orchestrator": "MarketIntelligenceOrchestrator",
      "source": "V2.2.5_RETAINED",
      "primary_output": "Feature/DomainState",
      "runtime_status": "NOT_IMPLEMENTED"
    },
    {
      "engine_id": 15,
      "engine_name": "LIQUIDITY CAPACITY ENGINE",
      "orchestrator": "MarketIntelligenceOrchestrator",
      "source": "V2.2.5_RETAINED",
      "primary_output": "Feature/DomainState",
      "runtime_status": "NOT_IMPLEMENTED"
    },
    {
      "engine_id": 16,
      "engine_name": "OPTIONS ENGINE",
      "orchestrator": "MarketIntelligenceOrchestrator",
      "source": "V2.2.5_RETAINED",
      "primary_output": "Feature/DomainState",
      "runtime_status": "NOT_IMPLEMENTED"
    },
    {
      "engine_id": 17,
      "engine_name": "GREEKS / GEX ENGINE",
      "orchestrator": "MarketIntelligenceOrchestrator",
      "source": "V2.2.5_RETAINED",
      "primary_output": "Feature/DomainState",
      "runtime_status": "NOT_IMPLEMENTED"
    },
    {
      "engine_id": 18,
      "engine_name": "FUTURES / OI ENGINE",
      "orchestrator": "MarketIntelligenceOrchestrator",
      "source": "V2.2.5_RETAINED",
      "primary_output": "Feature/DomainState",
      "runtime_status": "NOT_IMPLEMENTED"
    },
    {
      "engine_id": 19,
      "engine_name": "BTC DERIVATIVES ENGINE",
      "orchestrator": "MarketIntelligenceOrchestrator",
      "source": "V2.2.5_RETAINED",
      "primary_output": "Feature/DomainState",
      "runtime_status": "NOT_IMPLEMENTED"
    },
    {
      "engine_id": 20,
      "engine_name": "VOLATILITY ENGINE",
      "orchestrator": "MarketIntelligenceOrchestrator",
      "source": "V2.2.5_RETAINED",
      "primary_output": "Feature/DomainState",
      "runtime_status": "NOT_IMPLEMENTED"
    },
    {
      "engine_id": 21,
      "engine_name": "MACRO ENGINE",
      "orchestrator": "MarketIntelligenceOrchestrator",
      "source": "V2.2.5_RETAINED",
      "primary_output": "Feature/DomainState",
      "runtime_status": "NOT_IMPLEMENTED"
    },
    {
      "engine_id": 22,
      "engine_name": "NEWS / EVENT ENGINE",
      "orchestrator": "MarketIntelligenceOrchestrator",
      "source": "V2.2.5_RETAINED",
      "primary_output": "Feature/DomainState",
      "runtime_status": "NOT_IMPLEMENTED"
    },
    {
      "engine_id": 23,
      "engine_name": "CROSS-ASSET ENGINE",
      "orchestrator": "MarketIntelligenceOrchestrator",
      "source": "V2.2.5_RETAINED",
      "primary_output": "Feature/DomainState",
      "runtime_status": "NOT_IMPLEMENTED"
    },
    {
      "engine_id": 24,
      "engine_name": "POSITIONING / COT ENGINE",
      "orchestrator": "MarketIntelligenceOrchestrator",
      "source": "V2.2.5_RETAINED",
      "primary_output": "Feature/DomainState",
      "runtime_status": "NOT_IMPLEMENTED"
    },
    {
      "engine_id": 25,
      "engine_name": "SESSION ENGINE",
      "orchestrator": "MarketIntelligenceOrchestrator",
      "source": "V2.2.5_RETAINED",
      "primary_output": "Feature/DomainState",
      "runtime_status": "NOT_IMPLEMENTED"
    },
    {
      "engine_id": 26,
      "engine_name": "MARKET STATE ENGINE",
      "orchestrator": "MarketIntelligenceOrchestrator",
      "source": "V2.2.5_RETAINED",
      "primary_output": "MarketState",
      "runtime_status": "NOT_IMPLEMENTED"
    },
    {
      "engine_id": 27,
      "engine_name": "REGIME ENGINE",
      "orchestrator": "MarketIntelligenceOrchestrator",
      "source": "V2.2.5_RETAINED",
      "primary_output": "RegimeState",
      "runtime_status": "NOT_IMPLEMENTED"
    },
    {
      "engine_id": 28,
      "engine_name": "CONTEXT ENGINE",
      "orchestrator": "MarketIntelligenceOrchestrator",
      "source": "V2.2.5_RETAINED",
      "primary_output": "ContextState",
      "runtime_status": "NOT_IMPLEMENTED"
    },
    {
      "engine_id": 29,
      "engine_name": "LIQUIDITY MAP ENGINE",
      "orchestrator": "MarketIntelligenceOrchestrator",
      "source": "V2.2.5_RETAINED",
      "primary_output": "LiquidityMap",
      "runtime_status": "NOT_IMPLEMENTED"
    },
    {
      "engine_id": 30,
      "engine_name": "SETUP DETECTION ENGINE",
      "orchestrator": "DecisionResearchOrchestrator",
      "source": "V2.2.5_RETAINED",
      "primary_output": "SetupQuality/Conflict/Dependency",
      "runtime_status": "NOT_IMPLEMENTED"
    },
    {
      "engine_id": 31,
      "engine_name": "SETUP QUALITY ENGINE",
      "orchestrator": "DecisionResearchOrchestrator",
      "source": "V2.2.5_RETAINED",
      "primary_output": "SetupQuality/Conflict/Dependency",
      "runtime_status": "NOT_IMPLEMENTED"
    },
    {
      "engine_id": 32,
      "engine_name": "CONFLICT ENGINE",
      "orchestrator": "DecisionResearchOrchestrator",
      "source": "V2.2.5_RETAINED",
      "primary_output": "SetupQuality/Conflict/Dependency",
      "runtime_status": "NOT_IMPLEMENTED"
    },
    {
      "engine_id": 33,
      "engine_name": "ALPHA ENGINE",
      "orchestrator": "DecisionResearchOrchestrator",
      "source": "V2.2.5_RETAINED",
      "primary_output": "AlphaAssessment",
      "runtime_status": "NOT_IMPLEMENTED"
    },
    {
      "engine_id": 34,
      "engine_name": "ALPHA DEPENDENCY ENGINE",
      "orchestrator": "DecisionResearchOrchestrator",
      "source": "V2.2.5_RETAINED",
      "primary_output": "SetupQuality/Conflict/Dependency",
      "runtime_status": "NOT_IMPLEMENTED"
    },
    {
      "engine_id": 35,
      "engine_name": "STRATEGY LIBRARY",
      "orchestrator": "GovernanceOrchestrator",
      "source": "V2.2.5_RETAINED",
      "primary_output": "StrategyDefinition",
      "runtime_status": "NOT_IMPLEMENTED"
    },
    {
      "engine_id": 36,
      "engine_name": "STRATEGY ELIGIBILITY ENGINE",
      "orchestrator": "DecisionResearchOrchestrator",
      "source": "V2.2.5_RETAINED",
      "primary_output": "StrategyEligibility",
      "runtime_status": "NOT_IMPLEMENTED"
    },
    {
      "engine_id": 37,
      "engine_name": "EXPECTANCY ENGINE",
      "orchestrator": "DecisionResearchOrchestrator",
      "source": "V2.2.5_RETAINED",
      "primary_output": "ExpectancyAssessment",
      "runtime_status": "NOT_IMPLEMENTED"
    },
    {
      "engine_id": 38,
      "engine_name": "PROBABILITY CALIBRATION ENGINE",
      "orchestrator": "ResearchValidationOrchestrator",
      "source": "V2.2.5_RETAINED",
      "primary_output": "ProbabilityAssessment",
      "runtime_status": "NOT_IMPLEMENTED"
    },
    {
      "engine_id": 39,